{
  "spec": "baltor.showcase-task/v1",
  "task_id": "showcase_task_control_rename_function_refactor",
  "slug": "control-rename-function-refactor",
  "title": "Rename a function across a small package",
  "version": "1.0.0",
  "domain": "negative-control",
  "category": "control-coding",
  "negative_control": true,
  "summary": "Negative control. Rename calc_total to compute_order_total everywhere in a five-file package and keep tests passing.",
  "prompt": "Rename the function calc_total to compute_order_total everywhere in this workspace (definition, imports, calls, exports and tests). Behaviour must not change.",
  "requirements": [
    "The name calc_total no longer appears in any .py file.",
    "shop.compute_order_total, Cart.total and invoice_line return the same values as before for any items and tax rate.",
    "python3 -m pytest -q tests passes."
  ],
  "workspace_rules": [],
  "deliverables": [
    {
      "path": "shop/",
      "description": "refactored package"
    },
    {
      "path": "tests/",
      "description": "updated tests"
    }
  ],
  "inputs": {
    "workspace_files": [
      "shop/",
      "tests/test_shop.py"
    ],
    "hidden_files": [
      "expected.json"
    ],
    "network": "none",
    "data_sources": [
      {
        "name": "Seeded synthetic fixture",
        "kind": "synthetic",
        "licence": "MIT",
        "redistributed": false,
        "notes": "Generated by setup/make_fixtures.py from the fixture seed."
      }
    ]
  },
  "setup": {
    "entry": "setup/make_fixtures.py",
    "files": [
      {
        "path": "setup/make_fixtures.py",
        "sha256": "802981cd5f2f08df66425968dd7a0f7288e50d1c88e8bcc65f305ecc41e59b64"
      }
    ],
    "command": "python3 setup/make_fixtures.py --workspace {workspace} --hidden {hidden} --seed {fixture_seed}"
  },
  "evaluator": {
    "entry": "evaluate.py",
    "files": [
      {
        "path": "controls_fixtures.py",
        "sha256": "70d0c65791a771f07e7090e585433b13e66788da22b4fef820435a60ee1ad6ad"
      },
      {
        "path": "evaluate.py",
        "sha256": "db281c750c24ebae1f8c9ac4f31ec0f6616e57d4209c0c3cda751bcc2e189de0"
      },
      {
        "path": "showcase_eval.py",
        "sha256": "a80ae1abcc4d13c151db3fd7a3083fcc73ec8782bbbb3647c615e94fab13a8d0"
      }
    ],
    "command": "python3 evaluate.py --workspace {workspace} --hidden {hidden} --out {run_dir}/evaluation.json",
    "deterministic": true,
    "runs_agent_code": true,
    "external_tools": [],
    "timeout_s": 300
  },
  "metrics": [
    {
      "name": "correct_fraction",
      "description": "Share of answers, lines or rows that exactly match the expected output",
      "direction": "maximize",
      "weight": 1.0,
      "scale": [
        0.0,
        1.0
      ],
      "gate": true,
      "threshold": 1.0
    }
  ],
  "success": {
    "rule": "pass when correct_fraction >= 1",
    "min_score": 0.0,
    "required_checks": []
  },
  "budget": {
    "preset": "xs",
    "wall_time_s": 600,
    "tool_calls": 30,
    "tokens": 120000
  },
  "arms": {
    "baseline": {
      "description": "Harness and model alone.",
      "catalogue_access": "none",
      "preamble": "You are working in a fresh workspace. Read TASK.md first. Before you finish, check your deliverables against every requirement in TASK.md.",
      "preplaced": []
    },
    "treatment": {
      "description": "The same harness and model plus access to the Baltor catalogue. Nothing is pre-placed: the agent decides whether to search, what to read and what to place.",
      "catalogue_access": "search-read-place",
      "tools": [
        "intelligence_search",
        "provisioning_read",
        "baltor_catalog.py search",
        "baltor_catalog.py read",
        "baltor_catalog.py place"
      ],
      "preamble": "You are working in a fresh workspace. Read TASK.md first. Before you finish, check your deliverables against every requirement in TASK.md. You can also search the Baltor component catalogue (intelligence_search, or `python3 baltor_catalog.py search`) and download items (provisioning_read, or `baltor_catalog.py read/place`) if you think something there would help. Using it is optional.",
      "preplaced": [],
      "catalogue_exclusions": {
        "identity_prefixes": [
          "showcase_task_",
          "showcase_preregistration_ledger"
        ],
        "tags": [
          "showcase-task"
        ],
        "reason": "The task packages contain evaluators, reference outputs and fixture generators; an agent that reads them is not solving the task."
      },
      "catalogue_release": "recorded per run (catalog/release.json 'release'); one release for the whole study"
    },
    "held_constant": [
      "model and sampling settings",
      "harness and harness version",
      "budget",
      "starting workspace (same fixture seed per trial)",
      "network policy",
      "machine type",
      "prompt text apart from the one catalogue sentence",
      "evaluator version (spec hash)"
    ],
    "contamination_rule": "A treatment run whose transcript or step lock shows it read an excluded identity is marked contaminated and counted as a failure for the treatment arm."
  },
  "trials": {
    "per_arm": 5,
    "minimum_per_arm": 3,
    "order": "paired: in trial k both arms start from the same fixture seed; which arm runs first is showcase_eval.arm_order(spec_hash, k); arms never share a workspace",
    "fixture_seed": "showcase_eval.fixture_seed(spec_hash, k) = int(sha256(f'{spec_hash}:fixture:{k}')[:8], 16)"
  },
  "analysis": {
    "unit": "paired trial (one baseline run and one treatment run with the same fixture seed)",
    "primary_outcome": "passed (boolean) as printed by evaluate.py",
    "primary_effect": "treatment pass rate minus baseline pass rate, with a 95% percentile bootstrap interval over paired trials (10,000 resamples, resampling seed derived from the spec hash)",
    "secondary": [
      "mean composite score difference (treatment minus baseline) with a 95% bootstrap interval",
      "win rate: share of paired trials where the treatment score is higher (ties count one half)",
      "cost per run and per passing run: input and output tokens, wall time, tool calls, estimated USD",
      "blind pairwise preference where judging.pairwise is set (secondary evidence only)"
    ],
    "report_all_runs": true,
    "missing_or_failed_runs": "A run that crashes, times out, exceeds its budget or is contaminated counts as not passed with score 0 for its arm. Nothing is dropped or re-run selectively; a whole trial may be re-run only for an infrastructure fault, and the fault is reported.",
    "pooling": "Negative controls are analysed and reported separately. A pooled effect across tasks weights each task equally and is reported alongside every per-task result."
  },
  "hypothesis": {
    "expected_effect": "none",
    "rationale": "A capable model solves this without outside help, and no catalogue component targets it. Any treatment advantage beyond noise points to a placebo or prompt effect; extra treatment-arm tokens or tool calls measure the overhead of searching when nothing useful exists."
  },
  "judging": {
    "primary": "deterministic-evaluator",
    "pairwise": null
  },
  "expected_components": [],
  "expected_capabilities": [],
  "cost_metrics": [
    "input_tokens",
    "output_tokens",
    "cached_input_tokens",
    "wall_time_s",
    "tool_calls",
    "catalogue_calls",
    "usd_estimate"
  ],
  "requires_kaggle_account": false,
  "cautions": [],
  "disclosures": [
    "Conflict of interest: the tasks, evaluators and the Baltor catalogue components were written by the same team. Treat results as the team's own evaluation, not an independent study; independent replication is invited and every input needed to replicate is in this package.",
    "Deterministic evaluator results are the primary evidence. Blind pairwise and LLM-judge preferences, where collected, are weaker evidence and are reported separately.",
    "The task library and this ledger are excluded from the treatment arm's catalogue view so neither arm can read evaluators or reference outputs."
  ],
  "params": {
    "kind": "rename",
    "old_name": "calc_total",
    "new_name": "compute_order_total"
  },
  "spec_hash": "26384af9ebfc49578482c748e295a8014bb71157978b855fe28563efec0c6248",
  "preregistration": {
    "date": "2026-10-10",
    "revision": 2,
    "ledger": "showcase_preregistration_ledger",
    "hash_method": "sha256 of the canonical JSON of task.json without the keys spec_hash and preregistration (keys sorted, separators ',' ':', UTF-8, ensure_ascii false); see showcase_eval.compute_spec_hash"
  }
}
